{
  "auf": "1.0",
  "kind": "characterization",
  "subject": {
    "registry": "eip155:11155111:0x00000000000000000000000000000000000000f0",
    "unitId": 5,
    "version": 1,
    "boundaryHash": "0x1b0ae56ecffa30f6db1ac3d74d99e5dc40993d9e687ccaa58f407dc879f35728"
  },
  "roles": [
    {
      "role": "container",
      "scope": {
        "type": "element",
        "id": "0xcd5cb00e788e869b9d22d63f40b2c9ede7c7af2f0ce4aff031d717f7317551b0"
      },
      "mechanism": "funds",
      "state": "funded",
      "conditions": "while the tender is open"
    },
    {
      "role": "pledge",
      "scope": {
        "type": "element",
        "id": "0xcd5cb00e788e869b9d22d63f40b2c9ede7c7af2f0ce4aff031d717f7317551b0"
      },
      "mechanism": "reservation",
      "state": "awaiting acceptance",
      "conditions": "from submission until the judgment window closes"
    },
    {
      "role": "valve",
      "scope": {
        "type": "port",
        "id": "payout-out"
      },
      "mechanism": "trigger",
      "conditions": "opens only on acceptance"
    },
    {
      "role": "control",
      "scope": {
        "type": "port",
        "id": "acceptance-in"
      },
      "mechanism": "acceptance",
      "conditions": "one acceptance signal releases the whole bounty"
    },
    {
      "role": "conductor",
      "scope": {
        "type": "port",
        "id": "payout-out"
      },
      "mechanism": "transfer",
      "conditions": "escrow to worker"
    },
    {
      "role": "sink",
      "scope": {
        "type": "port",
        "id": "deliverable-in"
      },
      "mechanism": "consumption",
      "conditions": "the task absorbs the service demand of the buyer"
    },
    {
      "role": "damping",
      "scope": {
        "type": "unit"
      },
      "mechanism": "fee",
      "conditions": "protocol or judgment fees, if the tender charges any"
    }
  ],
  "attributes": {
    "linearity": "piecewise-linear",
    "determinism": "stochastic",
    "timeVariance": "time-varying",
    "memory": "history-dependent"
  },
  "structure": {
    "profile": "auf:structure:composite@1",
    "notes": "Conditional settlement composite: reserve, obligation, acceptance condition and payment path."
  },
  "knowledge": {
    "status": "classified"
  }
}
