{
  "auf": "1.0",
  "kind": "characterization",
  "subject": {
    "registry": "eip155:11155111:0x00000000000000000000000000000000000000f0",
    "unitId": 1,
    "version": 1,
    "boundaryHash": "0xc40a52fa746780d73fdb2e55cca604746ea4f8d324ca3f53891f198efda44bb1"
  },
  "roles": [
    {
      "role": "source",
      "scope": {
        "type": "port",
        "id": "service-out"
      },
      "mechanism": "production",
      "conditions": "per licensed invocation"
    },
    {
      "role": "container",
      "scope": {
        "type": "element",
        "id": "0x1e753103d4a6e1908f5d7fb776a3b24e2b1b38a02165709adbdfd25bc34f6c1e"
      },
      "mechanism": "funds",
      "state": "liquid"
    },
    {
      "role": "damping",
      "scope": {
        "type": "port",
        "id": "hosting-out"
      },
      "mechanism": "resource-use",
      "conditions": "hosting cost per month"
    },
    {
      "role": "conductor",
      "scope": {
        "type": "element",
        "id": "0x590b6caa3dc99f05fa3fb9ad3a3d501b8cb9f54cefa7ec0cb23e39dfd93e94c4"
      },
      "mechanism": "transfer",
      "conditions": "delivers invocation results to licensees"
    }
  ],
  "attributes": {
    "linearity": "piecewise-linear",
    "determinism": "deterministic",
    "timeVariance": "time-varying",
    "memory": "memoryless"
  },
  "structure": {
    "profile": "auf:structure:composite@1"
  },
  "knowledge": {
    "status": "classified"
  }
}
