{
  "auf": "1.0",
  "kind": "characterization",
  "subject": {
    "registry": "eip155:11155111:0x00000000000000000000000000000000000000f0",
    "unitId": 2,
    "version": 1,
    "boundaryHash": "0xf68becf6e98da7642e950c126a6a0ca15e0a08a373044bf09c9e0cbb60dfac62"
  },
  "roles": [
    {
      "role": "source",
      "scope": {
        "type": "port",
        "id": "service-out"
      },
      "mechanism": "production"
    },
    {
      "role": "container",
      "scope": {
        "type": "element",
        "id": "0x5aeb2b65744761bc79f18d40baf69f03221c2bea775b751a434d115224ebb408"
      },
      "mechanism": "funds"
    },
    {
      "role": "control",
      "scope": {
        "type": "element",
        "id": "0xfcbebbecff638c8597fb0db7b30f0b9170d462dd1e26974e337738d06de72ac7"
      },
      "mechanism": "budget",
      "conditions": "agent policy decides spending"
    }
  ],
  "structure": {
    "profile": "auf:structure:composite@1"
  },
  "knowledge": {
    "status": "classified"
  }
}
