{
  "auf": "1.0",
  "kind": "characterization",
  "subject": {
    "registry": "eip155:11155111:0x00000000000000000000000000000000000000f0",
    "unitId": 7,
    "version": 1,
    "boundaryHash": "0xf34213a491b9e655c353ad0dddec49f97b8d995671dd64d228ade79a2d7bb5ba"
  },
  "roles": [
    {
      "role": "source",
      "scope": {
        "type": "port",
        "id": "service-out"
      },
      "mechanism": "production",
      "conditions": "paid requests"
    },
    {
      "role": "container",
      "scope": {
        "type": "element",
        "id": "0x7f48dfe7185c4e6c3e03eb5e1a7da25375e69402e944f51f44454f0476a25e32"
      },
      "mechanism": "funds"
    },
    {
      "role": "damping",
      "scope": {
        "type": "port",
        "id": "compute-out"
      },
      "mechanism": "resource-use",
      "conditions": "compute cost per request"
    },
    {
      "role": "sink",
      "scope": {
        "type": "element",
        "id": "0xc70f576d20b3931b3a23e9d85488fc95edaf64dd8a58fc4c1d742877597fec97"
      },
      "mechanism": "consumption"
    },
    {
      "role": "control",
      "scope": {
        "type": "port",
        "id": "policy-in"
      },
      "mechanism": "budget",
      "conditions": "operator limits gate spending"
    },
    {
      "role": "control",
      "scope": {
        "type": "element",
        "id": "0xb7c820fc7d1550ef8072731ae59c50d79f4dede020a312ba7243bdfe368be861"
      },
      "mechanism": "pricing",
      "conditions": "the agent sets per-request prices"
    }
  ],
  "attributes": {
    "linearity": "nonlinear",
    "determinism": "stochastic",
    "timeVariance": "time-varying",
    "memory": "history-dependent"
  },
  "models": [
    {
      "profile": "auf:model:financial-circuit@1",
      "variables": {
        "q": {
          "stands_for": "stable balance of the treasury",
          "unit": "USD"
        },
        "i": {
          "stands_for": "net stable flow through revenue-in and compute-out",
          "unit": "USD per day"
        },
        "v": {
          "stands_for": "price margin per request over compute cost",
          "unit": "USD per request"
        },
        "phi": {
          "stands_for": "time integral of the margin",
          "unit": "USD per request times days"
        }
      },
      "elements": [
        {
          "scope": {
            "type": "port",
            "id": "service-out"
          },
          "type": "source",
          "parameters": {
            "kind": "flow source",
            "notes": "request volume drives i"
          }
        },
        {
          "scope": {
            "type": "element",
            "id": "0x7f48dfe7185c4e6c3e03eb5e1a7da25375e69402e944f51f44454f0476a25e32"
          },
          "type": "capacitive",
          "parameters": {
            "notes": "balance accumulates net flow"
          }
        },
        {
          "scope": {
            "type": "port",
            "id": "compute-out"
          },
          "type": "resistive",
          "parameters": {
            "notes": "cost proportional to request volume within the reserved quota"
          }
        },
        {
          "scope": {
            "type": "element",
            "id": "0xb7c820fc7d1550ef8072731ae59c50d79f4dede020a312ba7243bdfe368be861"
          },
          "type": "controlled",
          "parameters": {
            "notes": "pricing policy modulates the source"
          }
        },
        {
          "scope": {
            "type": "port",
            "id": "policy-in"
          },
          "type": "switch",
          "parameters": {
            "notes": "operator can halt spending"
          }
        }
      ],
      "premises": {
        "window": "P30D",
        "operatingRange": "request volume within the reserved GPU hours",
        "linearization": "constant price and cost per request within the window",
        "errorBound": "not estimated"
      },
      "applicability": {
        "window": "P30D",
        "scale": "daily flows",
        "operatingRange": "within quota",
        "errorBound": "not estimated"
      }
    }
  ],
  "structure": {
    "profile": "auf:structure:chip@1",
    "interfaces": [
      "service-out",
      "revenue-in",
      "compute-out",
      "policy-in"
    ]
  },
  "applications": [
    {
      "profile": "auf:application:credit@1",
      "parameters": {
        "terms": [
          "compute credit line of the provider"
        ],
        "inputs": [
          "settled invoices",
          "agent identity record"
        ],
        "rule": "provider policy",
        "downgrade": "two missed invoices"
      }
    }
  ],
  "knowledge": {
    "status": "classified"
  }
}
