{
  "auf": "1.0",
  "kind": "characterization",
  "subject": {
    "registry": "eip155:11155111:0x00000000000000000000000000000000000000f0",
    "unitId": 3,
    "version": 1,
    "boundaryHash": "0x7015a366e2cb993f09e822a54917610539f8b9e4a97a89f976b9dedce97612f3"
  },
  "roles": [
    {
      "role": "source",
      "scope": {
        "type": "port",
        "id": "service-out"
      },
      "mechanism": "production"
    },
    {
      "role": "container",
      "scope": {
        "type": "element",
        "id": "0x874beddf623c4cd0d40c852a94b7a71026c468d2c29c6d933aaf2bc24387be54"
      },
      "mechanism": "funds"
    },
    {
      "role": "control",
      "scope": {
        "type": "element",
        "id": "0x152142c5905bfb5c906be56b4b1f0dc0cbb461d32d8a94178172f0f12afa4d97"
      },
      "mechanism": "budget",
      "conditions": "agent policy decides spending"
    }
  ],
  "structure": {
    "profile": "auf:structure:composite@1"
  },
  "knowledge": {
    "status": "classified"
  }
}
