{
  "auf": "1.0",
  "kind": "characterization",
  "subject": {
    "registry": "eip155:11155111:0x00000000000000000000000000000000000000f0",
    "unitId": 11,
    "version": 1,
    "boundaryHash": "0xd540ed55e09fd544e0050f5c06ffac69bcc778b7c630026923a9e598bad0e3e8"
  },
  "structure": {
    "profile": "auf:structure:composite@1"
  },
  "knowledge": {
    "status": "insufficient-evidence",
    "notes": "Whether the token position and the contractual right are the same claim is not established in this definition."
  }
}
